<?xml version="1.0" encoding="UTF-8"?>
<xsd:schema xmlns:xsd="http://www.w3.org/2001/XMLSchema">
    
    <xsd:complexType name="bankDepositor_type">
        <xsd:sequence>
            <xsd:element name="depositorId" type="xsd:long"/>
            <xsd:element name="depositorName">
                <xsd:simpleType>
                    <xsd:restriction base="xsd:string">
                        <xsd:pattern value="[A-Z][a-z]+[0-9]*"/>
                    </xsd:restriction>
                </xsd:simpleType>
            </xsd:element>
            <xsd:element name="depositorDateDeposit" type="xsd:date"/>
            <xsd:element name="depositorAmountDeposit">
                <xsd:simpleType>
                    <xsd:restriction base="xsd:positiveInteger">
                        <xsd:minInclusive value="100"/>
                    </xsd:restriction>
                </xsd:simpleType>
            </xsd:element>
            <xsd:element name="depositorAmountPlusDeposit">
                <xsd:simpleType>
                    <xsd:restriction base="xsd:positiveInteger">
                        <xsd:minInclusive value="0"/>
                    </xsd:restriction>
                </xsd:simpleType>
            </xsd:element>
            <xsd:element name="depositorAmountMinusDeposit">
                <xsd:simpleType>
                    <xsd:restriction base="xsd:positiveInteger">
                        <xsd:minInclusive value="0"/>
                    </xsd:restriction>
                </xsd:simpleType>
            </xsd:element>
            <xsd:element name="depositorDateReturnDeposit" type="xsd:date"/>
            <xsd:element name="depositorMarkReturnDeposit">
                <xsd:simpleType>
                    <xsd:restriction base="xsd:int">
                        <xsd:pattern value="[0,1]"/>
                    </xsd:restriction>
                </xsd:simpleType>
            </xsd:element>
        </xsd:sequence>
    </xsd:complexType>

    <xsd:complexType name="bankDepositors_type">
        <xsd:sequence>
            <xsd:element name="bankDepositor" type="bankDepositor_type" minOccurs="0" maxOccurs="unbounded"/>
        </xsd:sequence>
    </xsd:complexType>

    <xsd:complexType name="bankDeposit_type">
        <xsd:sequence>
            <xsd:element name="depositId" type="xsd:long" minOccurs="0" maxOccurs="unbounded"/>
            <xsd:element name="depositName">
                <xsd:simpleType>
                    <xsd:restriction base="xsd:string">
                        <xsd:pattern value="[A-Z][a-z]+[0-9]*"/>
                    </xsd:restriction>
                </xsd:simpleType>
            </xsd:element>
            <xsd:element name="depositMinTerm">
                <xsd:simpleType>
                    <xsd:restriction base="xsd:positiveInteger">
                        <xsd:minExclusive value="1"/>
                        <xsd:maxInclusive value="480"/>
                    </xsd:restriction>
                </xsd:simpleType>
            </xsd:element>
            <xsd:element name="depositMinAmount">
                <xsd:simpleType>
                    <xsd:restriction base="xsd:positiveInteger">
                        <xsd:minInclusive value="100"/>
                    </xsd:restriction>
                </xsd:simpleType>
            </xsd:element>
            <xsd:element name="depositCurrency">
                <xsd:simpleType>
                    <xsd:restriction base="xsd:string">
                        <xsd:pattern value="[A-Z]{3}"/>
                    </xsd:restriction>
                </xsd:simpleType>
            </xsd:element>
            <xsd:element name="depositInterestRate">
                <xsd:simpleType>
                    <xsd:restriction base="xsd:positiveInteger">
                        <xsd:minInclusive value="1"/>
                        <xsd:maxInclusive value="100"/>
                    </xsd:restriction>
                </xsd:simpleType>
            </xsd:element>
            <xsd:element name="depositAddConditions" type="xsd:string" minOccurs="0"/>
            <xsd:element name="bankDepositors" type="bankDepositors_type" minOccurs="1" maxOccurs="1"/>
        </xsd:sequence>
    </xsd:complexType>

    <xsd:complexType name="bankDeposits_type">
        <xsd:sequence>
            <xsd:element name="bankDeposit" type="bankDeposit_type" minOccurs="0" maxOccurs="unbounded"/>
        </xsd:sequence>
    </xsd:complexType>

    <xsd:element name="bankDeposits" type="bankDeposits_type"/>

</xsd:schema>